paperId,doi,title,year,verdict,estimand_cell,evidence_type,treatment,outcome,direction,reason,ra_decision,ra_note
W2001618027,10.1016/j.econlet.2010.11.014,Income distribution and macroeconomics: Fertility adjustment prior to education investment,2010,UNCERTAIN,OFF_EXPOSURE,other,education or schooling,fertility or family formation,forward,title is plausibly relevant but no abstract is available,,
W1533727680,,Is Rural Child Labour Declining in India,2010,NOT_RELEVANT,NA,observational,n/a,n/a,n/a,does not study a covered legal-policy mechanism,,
W4229649773,10.14301/llcs.v1i3.108,"LLCS Vol 1, Issue 3, Full Issue",2010,NOT_RELEVANT,NA,other,n/a,life-course research issue,n/a,"Full journal issue centered on cognitive ability, with no indicated covered estimand.",,
W36162907,10.1016/j.ccc.2022.06.016,La Encuesta de Presupuestos Familiares,2010,NOT_RELEVANT,NA,other,n/a,n/a,n/a,title and abstract do not study a covered legal-policy mechanism,,
W2099665362,10.1016/j.jhealeco.2010.03.007,Long term effects of childhood asthma on adult health,2010,NOT_RELEVANT,NA,other,n/a,n/a,n/a,title and abstract do not study a covered legal-policy mechanism,,
W1953626533,10.1086/653830,Multiple Experiments for the Causal Link between the Quantity and Quality of Children,2010,NOT_RELEVANT,NA,quasi-experimental,n/a,n/a,n/a,does not study a covered legal-policy mechanism,,
W17100436,10.1063/1.2353147,"Quality After School Time: An Evaluative Study of the Eastside Story After School Program in Austin, TX",2010,NOT_RELEVANT,NA,observational,n/a,n/a,n/a,No covered child-labor or compulsory-schooling policy-to-fertility relationship is indicated.,,
W2077426413,10.1016/j.jpubeco.2010.09.004,Risky behavior among youth: Incapacitation effects of school on adolescent motherhood and crime in Chile,2010,NOT_RELEVANT,NA,observational,n/a,n/a,n/a,does not study a covered legal-policy mechanism,,
W3124778444,10.1111/j.1468-2354.2009.00569.x,THE 2008 LAWRENCE R. KLEIN LECTURE—COMPARATIVE ECONOMIC DEVELOPMENT: INSIGHTS FROM UNIFIED GROWTH THEORY*,2010,NOT_RELEVANT,NA,theory,n/a,comparative economic development,n/a,Unified-growth overview does not identify child-labor or compulsory-schooling legislation as the treatment.,,
W2073400560,10.1162/qjec.2010.125.2.515,The (Perceived) Returns to Education and the Demand for Schooling<sup>*</sup>,2010,NOT_RELEVANT,NA,observational,n/a,n/a,n/a,does not study a covered legal-policy mechanism,,
W2102070748,10.1017/cbo9780511794834,"The Cambridge economic history of modern Europe, Volume 1, 1700-1870",2010,NOT_RELEVANT,NA,observational,n/a,n/a,n/a,No covered child-labor or compulsory-schooling policy-to-fertility relationship is indicated.,,
W1530653388,,The Causal Eff ect of Parent’s Schooling on Children’s Schooling,2010,NOT_RELEVANT,NA,review,n/a,n/a,n/a,No covered child-labor or compulsory-schooling policy-to-fertility relationship is indicated.,,
W1518906932,10.3386/w16013,The Effect of Education on Adult Health and Mortality: Evidence from Britain,2010,RELEVANT,OFF_OUTCOME,quasi-experimental,compulsory-schooling law,schooling or child labor,forward,Directly examines a covered policy or mechanism first stage without a fertility outcome.,,
W1995719795,10.1016/j.worlddev.2009.12.009,The Effect of ILO Minimum Age Conventions on Child Labor and School Attendance: Evidence From Aggregate and Individual-Level Data,2010,UNCERTAIN,OFF_OUTCOME,other,child-labor regulation,schooling or child labor,forward,"Title suggests a potentially covered relationship, but the missing or ambiguous abstract prevents confident routing.",,
W2207641446,10.2139/ssrn.1699058,The Effects of Stricter Compulsory Schooling Legislation on School Quality,2010,UNCERTAIN,OFF_OUTCOME,other,compulsory-schooling law,schooling or child labor,forward,"Title suggests a potentially covered relationship, but the missing or ambiguous abstract prevents confident routing.",,
W1985698168,10.1007/s10887-010-9058-6,The Galor–Weil gender-gap model revisited: from home to market,2010,NOT_RELEVANT,NA,theory,n/a,n/a,n/a,No covered child-labor or compulsory-schooling policy-to-fertility relationship is indicated.,,
W2624267706,,The Impact of poverty and educational policy on child labor in Indonesia,2010,UNCERTAIN,OFF_OUTCOME,other,child-labor policy,child labor,forward,"Title suggests a potentially covered relationship, but the missing or ambiguous abstract prevents confident routing.",,
W2050482467,10.2307/j.ctvjf9x5x.11,The Race between Education and Technology,2010,NOT_RELEVANT,NA,observational,n/a,n/a,n/a,does not study a covered legal-policy mechanism,,
W4297897894,10.2307/j.ctvjf9x5x,The Race between Education and Technology,2010,NOT_RELEVANT,NA,observational,n/a,n/a,n/a,does not study a covered legal-policy mechanism,,
W2130597491,,"The effect of schooling on fertility, labor market participation and children's outcomes, evidence from Ecuador",2010,NOT_RELEVANT,NA,theory,n/a,n/a,n/a,does not study a covered legal-policy mechanism,,
W2056449432,10.1007/s10887-010-9059-5,The role of mortality in the transmission of knowledge,2010,NOT_RELEVANT,NA,other,n/a,n/a,n/a,title and abstract do not study a covered legal-policy mechanism,,
W1541510025,10.1017/cbo9780511794834.003,"Understanding growth in Europe, 1700–1870: theory and evidence",2010,NOT_RELEVANT,NA,theory,n/a,n/a,n/a,does not study a covered legal-policy mechanism,,
W2169661062,10.1111/j.1465-7295.2009.00229.x,WELFARE IMPACT OF A BAN ON CHILD LABOR,2010,NOT_RELEVANT,NA,other,n/a,n/a,n/a,title and abstract do not study a covered legal-policy mechanism,,
W1965706869,10.1016/j.eeh.2010.05.001,"Was Malthus right? The relationship between population and real wages in Italian history, 1320 to 1870",2010,NOT_RELEVANT,NA,other,n/a,n/a,n/a,title and abstract do not study a covered legal-policy mechanism,,
W2101422309,10.3386/w15663,Who Owns Children and Does it Matter?,2010,NOT_RELEVANT,NA,theory,n/a,fertility efficiency,n/a,Models ownership of children and pronatalist policy without child-labor or compulsory-schooling regulation.,,
W2315289030,,Women's labor force participation in Spain: An analysis from dictatorship to democracy,2010,NOT_RELEVANT,NA,observational,n/a,n/a,n/a,No covered child-labor or compulsory-schooling policy-to-fertility relationship is indicated.,,
W1487292372,10.1057/9780230280823_9,economic growth in the very long run,2010,NOT_RELEVANT,NA,observational,n/a,n/a,n/a,No covered child-labor or compulsory-schooling policy-to-fertility relationship is indicated.,,
W2477436150,10.1057/9780230280823_20,growth take-offs,2010,NOT_RELEVANT,NA,other,n/a,n/a,n/a,title and abstract do not study a covered legal-policy mechanism,,
W1587487325,10.1057/9780230280823_21,"human capital, fertility and growth",2010,NOT_RELEVANT,NA,observational,n/a,n/a,n/a,No covered child-labor or compulsory-schooling policy-to-fertility relationship is indicated.,,
W4250917475,10.1057/9780230280823_27,poverty traps,2010,NOT_RELEVANT,NA,theory,n/a,n/a,n/a,No covered child-labor or compulsory-schooling policy-to-fertility relationship is indicated.,,
W2324722640,,zur Erlangung der Doktorwurde der Wirtschafts- und Verhaltenswissenschaftlichen Fakultat der Albert-Ludwigs-Universitat Freiburg i. Br.,2010,NOT_RELEVANT,NA,observational,n/a,n/a,n/a,does not study a covered legal-policy mechanism,,
W2134672432,10.2139/ssrn.1527859,2008 Lawrence R. Klein Lecture - Comparative Economic Development: Insights from Unified Growth Theory,2009,NOT_RELEVANT,NA,theory,n/a,n/a,n/a,No covered child-labor or compulsory-schooling policy-to-fertility relationship is indicated.,,
W1603198827,10.2139/ssrn.1506304,Adolescent Motherhood and Secondary Schooling in Chile,2009,UNCERTAIN,OFF_EXPOSURE,other,education or schooling,fertility timing,forward,"Title suggests a potentially covered relationship, but the missing or ambiguous abstract prevents confident routing.",,
W1530682865,,Avaliação do impacto dos programas de transferência monetária condicionada na taxa de frequência escolar e labor infantil: o caso do Programa JUNTOS no Peru,2009,NOT_RELEVANT,NA,other,n/a,n/a,n/a,title and abstract do not study a covered legal-policy mechanism,,
W1995734965,10.1080/15433710802633411,Bridging the Gap From Availability to Accessibility: Providing Health and Mental Health Services in Schools,2009,NOT_RELEVANT,NA,observational,n/a,n/a,n/a,does not study a covered legal-policy mechanism,,
W3123259869,10.1017/s1365100508080036,CHILD LABOR AND THE EDUCATION OF A SOCIETY,2009,RELEVANT,OFF_OUTCOME,structural,covered schooling or child-labor law,non-fertility outcome,forward,covered legal policy is studied directly,,
W2110116612,10.1016/j.socec.2009.11.001,Can demographic transition only be explained by altruistic and neo-Malthusian models?,2009,NOT_RELEVANT,NA,theory,n/a,demographic transition,n/a,General demographic-transition theory without an indicated child-labor or compulsory-schooling policy treatment.,,
W2912295803,10.1016/s1574-0129(08)00001-x,Chapter 1 Origins and Consequences of Child-Labor Restrictions: A Macroeconomic Perspective,2009,NOT_RELEVANT,NA,theory,n/a,n/a,n/a,title and abstract do not study a covered legal-policy mechanism,,
W3121888485,10.1016/j.jdeveco.2009.01.006,Child labor and household wealth: Theory and empirical evidence of an inverted-U,2009,NOT_RELEVANT,NA,theory,n/a,n/a,n/a,No covered child-labor or compulsory-schooling policy-to-fertility relationship is indicated.,,
W2022635778,10.1016/j.jmacro.2009.02.004,"Child labor, education aid, and economic growth",2009,NOT_RELEVANT,NA,observational,n/a,n/a,n/a,does not study a covered legal-policy mechanism,,
W2031867027,10.1108/09555340910925175,Child labour and supply chain: profitability or (mis)management,2009,NOT_RELEVANT,NA,other,n/a,n/a,n/a,title and abstract do not study a covered legal-policy mechanism,,
W2731542629,10.5167/uzh-28473,Child labour: is international activism the solution or the problem?,2009,RELEVANT,OFF_OUTCOME,observational,child-labor policy,child labor,forward,Directly examines a covered policy or mechanism first stage without a fertility outcome.,,
W2065029886,10.1007/s00148-009-0248-5,Child mortality and fertility: public vs private education,2009,UNCERTAIN,OFF_EXPOSURE,other,education or schooling,fertility or family formation,forward,title is plausibly relevant but no abstract is available,,
W2124825635,10.1162/jeea.2009.7.2-3.487,"Children, Education, Labor, and Land: In The Long Run and Short Run",2009,NOT_RELEVANT,NA,theory,n/a,n/a,n/a,does not study a covered legal-policy mechanism,,
W2554033298,,Chukyo University Institute of Economics Discussion Paper Series,2009,NOT_RELEVANT,NA,other,n/a,n/a,n/a,title and abstract do not study a covered legal-policy mechanism,,
W2121402688,10.1111/j.1468-0297.2009.02306.x,Contraception as Development? New Evidence from Family Planning in Colombia,2009,NOT_RELEVANT,NA,other,n/a,n/a,n/a,title and abstract do not study a covered legal-policy mechanism,,
W1580479354,10.2139/ssrn.1506305,Delaying the Bell: The Effects of Longer School Days on Adolescent Motherhood in Chile,2009,NOT_RELEVANT,NA,other,n/a,n/a,n/a,title and abstract do not study a covered legal-policy mechanism,,
W1969004750,10.1016/j.red.2009.03.002,Demographic transition and industrial revolution: A macroeconomic investigation,2009,NOT_RELEVANT,NA,other,n/a,n/a,n/a,No covered child-labor or compulsory-schooling policy-to-fertility relationship is indicated.,,
W2140161313,10.1007/s00148-009-0255-6,Demographic transitions: analyzing the effects of mortality on fertility,2009,NOT_RELEVANT,NA,other,n/a,n/a,n/a,No covered child-labor or compulsory-schooling policy-to-fertility relationship is indicated.,,
W2128545160,10.2139/ssrn.1554814,Do International Labor Standards Contribute to the Persistence of the Child Labor Problem?,2009,UNCERTAIN,OFF_OUTCOME,other,child-labor policy,child labor,forward,"Title suggests a potentially covered relationship, but the missing or ambiguous abstract prevents confident routing.",,
W2890845387,10.1007/s10887-009-9048-8,Do international labor standards contribute to the persistence of the child-labor problem?,2009,NOT_RELEVANT,NA,other,n/a,n/a,n/a,No covered child-labor or compulsory-schooling policy-to-fertility relationship is indicated.,,
W2138584707,10.2139/ssrn.1532664,Econometric Methods for Causal Evaluation of Education Policies and Practices: A Non-Technical Guide,2009,NOT_RELEVANT,NA,review,n/a,n/a,n/a,No covered child-labor or compulsory-schooling policy-to-fertility relationship is indicated.,,
W2080114260,10.1108/03684920910930312,Economic yoyos and some mysteries about child labor,2009,NOT_RELEVANT,NA,theory,n/a,n/a,n/a,does not study a covered legal-policy mechanism,,
W2028763682,10.1016/j.econlet.2009.10.003,Effects of the complementarity of child nutrition and education on persistent deprivation,2009,NOT_RELEVANT,NA,theory,n/a,child nutrition and education deprivation,n/a,Nutrition-education complementarity does not indicate the covered policy or fertility outcome.,,
W2137126375,10.2139/ssrn.1021644,From Duty to Right: The Role of Public Education in the Transition to Aging Societies,2009,NOT_RELEVANT,NA,other,n/a,n/a,n/a,title and abstract do not study a covered legal-policy mechanism,,
W2168072729,10.2139/ssrn.1443949,"From Malthus to Modern Growth: Child Labor, Schooling and Human Capital",2009,UNCERTAIN,OFF_OUTCOME,other,potential covered policy,n/a,n/a,title is plausibly relevant but no abstract is supplied,,
W3023851255,10.1016/j.jdeveco.2009.07.003,From duty to right: The role of public education in the transition to aging societies,2009,NOT_RELEVANT,NA,observational,n/a,n/a,n/a,does not study a covered legal-policy mechanism,,
W1534481432,10.3386/w15339,How large are returns to schooling? Hint: Money isn't everything,2009,NOT_RELEVANT,NA,other,n/a,n/a,n/a,title and abstract do not study a covered legal-policy mechanism,,
W1523522293,10.2139/ssrn.1404728,"Immigration Policy, Remittances, and Growth in the Migrant-Sending Country",2009,NOT_RELEVANT,NA,other,n/a,n/a,n/a,title and abstract do not study a covered legal-policy mechanism,,
W1481804660,10.2139/ssrn.1502416,Income Distribution and Macroeconomics Revisited: The Role of Fertility Adjustment,2009,NOT_RELEVANT,NA,other,n/a,n/a,n/a,No covered child-labor or compulsory-schooling policy-to-fertility relationship is indicated.,,
W1528768206,,Inequality and Economic Development: An Overview,2009,NOT_RELEVANT,NA,other,n/a,n/a,n/a,title and abstract do not study a covered legal-policy mechanism,,
W2037030453,10.1016/j.jmacro.2009.06.005,Intergenerational transfers and fertility: Trade-off between human capital and child labour,2009,NOT_RELEVANT,NA,other,n/a,n/a,n/a,No covered child-labor or compulsory-schooling policy-to-fertility relationship is indicated.,,
W1987824042,10.1353/foc.0.0022,Introducing the Issue,2009,NOT_RELEVANT,NA,other,n/a,n/a,n/a,title and abstract do not study a covered legal-policy mechanism,,
W2098808544,10.1093/ije/dyp226,Is education causally related to better health? A twin fixed-effect study in the USA,2009,NOT_RELEVANT,NA,other,n/a,n/a,n/a,title and abstract do not study a covered legal-policy mechanism,,
W3122008562,10.1353/jhr.2009.0015,"Kindergarten Entrance Age and Children's Achievement: Impacts of State Policies, Family Background, and Peers",2009,NOT_RELEVANT,NA,observational,n/a,n/a,n/a,No covered child-labor or compulsory-schooling policy-to-fertility relationship is indicated.,,
W1995702785,10.1016/j.econedurev.2009.02.004,Labour market effects of the polytechnic education reform: The Finnish experience,2009,NOT_RELEVANT,NA,quasi-experimental,n/a,n/a,n/a,does not study a covered legal-policy mechanism,,
W3122959112,10.2139/ssrn.941936,Longevity and Lifetime Labor Supply: Evidence and Implications,2009,NOT_RELEVANT,NA,observational,n/a,n/a,n/a,does not study a covered legal-policy mechanism,,
W2075162451,10.1016/j.euroecorev.2009.09.001,Measuring heterogeneity in the returns to education using an education reform,2009,NOT_RELEVANT,NA,quasi-experimental,n/a,n/a,n/a,does not study a covered legal-policy mechanism,,
W2096750213,10.1016/j.jeconom.2009.03.012,Optimally combining censored and uncensored datasets,2009,NOT_RELEVANT,NA,observational,n/a,n/a,n/a,does not study a covered legal-policy mechanism,,
W1979806988,10.1257/app.2.1.33,Parental Education and Child Health: Evidence from a Natural Experiment in Taiwan,2009,NOT_RELEVANT,NA,other,n/a,n/a,n/a,title and abstract do not study a covered legal-policy mechanism,,
W1977144702,10.1016/j.jpubeco.2009.02.002,Public provision of private child goods,2009,NOT_RELEVANT,NA,other,n/a,n/a,n/a,No covered child-labor or compulsory-schooling policy-to-fertility relationship is indicated.,,
W1544296022,,Putting teenagers on the pill : The consequences of subsidized contraception,2009,RELEVANT,OFF_EXPOSURE,quasi-experimental,education or schooling,fertility timing,forward,Studies education access or attainment and fertility without a clearly covered legal mandate.,,
W2110831980,10.1007/s10887-009-9041-2,Reconciling Kuznets and Habbakuk in a unified growth theory,2009,NOT_RELEVANT,NA,other,n/a,n/a,n/a,title and abstract do not study a covered legal-policy mechanism,,
W4299678552,10.1257/aer.99.2.i,The American Economic Review,2009,NOT_RELEVANT,NA,review,n/a,n/a,n/a,does not study a covered legal-policy mechanism,,
W3121861179,10.2139/ssrn.1619820,The Evolution of Markets and the Revolution of Industry: A Unified Theory of Growth,2009,NOT_RELEVANT,NA,theory,n/a,n/a,n/a,title and abstract do not study a covered legal-policy mechanism,,
W2153437464,10.1111/j.1468-0335.2009.00840.x,"The Expansion and Convergence of Compulsory Schooling in Western Europe, 1950-2000",2009,RELEVANT,OFF_OUTCOME,other,covered schooling or child-labor law,non-fertility outcome,forward,covered legal policy is studied directly,,
W2147788062,10.1162/rest.91.3.478,The Impact of Childhood Health on Adult Labor Market Outcomes,2009,NOT_RELEVANT,NA,observational,n/a,n/a,n/a,does not study a covered legal-policy mechanism,,
W1886840123,10.2139/ssrn.1521228,The Impact of the Tax-Transfer System on Education and Skills in Australia,2009,NOT_RELEVANT,NA,other,n/a,education and skills,n/a,Tax-transfer and skills topic has no indicated fertility or covered legal-policy link.,,
W1601076042,10.2139/ssrn.1489243,Understanding Compulsory Schooling Legislation: A Formal Model and Implications for Empirical Analysis,2009,UNCERTAIN,OFF_OUTCOME,theory,compulsory-schooling law,schooling or child labor,forward,"Title suggests a potentially covered relationship, but the missing or ambiguous abstract prevents confident routing.",,
W2104143462,10.1162/qjec.2009.124.4.1541,Women's Liberation: What's in It for Men?<sup>*</sup>,2009,NOT_RELEVANT,NA,theory,n/a,n/a,n/a,does not study a covered legal-policy mechanism,,
W2359585542,10.2139/ssrn.1621622,Women's Rights and Development,2009,NOT_RELEVANT,NA,other,n/a,n/a,n/a,No covered child-labor or compulsory-schooling policy-to-fertility relationship is indicated.,,
W2010711301,10.1111/j.1467-9442.2008.00526.x,Adult Outcomes for Children of Teenage Mothers,2008,RELEVANT,OFF_EXPOSURE,observational,education or schooling,fertility timing,forward,Studies education access or attainment and fertility without a clearly covered legal mandate.,,
W3125952642,10.1016/j.jpubeco.2008.06.005,"Altruism, fertility, and the value of children: Health policy evaluation and intergenerational welfare",2008,NOT_RELEVANT,NA,observational,n/a,n/a,n/a,does not study a covered legal-policy mechanism,,
W2185177391,,CEE DP 100 Education & Mobility,2008,NOT_RELEVANT,NA,other,n/a,n/a,n/a,title and abstract do not study a covered legal-policy mechanism,,
W1529479161,10.52324/001c.8268,China’s Regional Disparity in Demographic Transition: A Spatial Analysis,2008,NOT_RELEVANT,NA,other,n/a,n/a,n/a,title and abstract do not study a covered legal-policy mechanism,,
W3124116706,10.2139/ssrn.1157260,Does Fertility Respond to Financial Incentives?,2008,NOT_RELEVANT,NA,observational,n/a,n/a,n/a,does not study a covered legal-policy mechanism,,
W2154065990,10.1136/jech.2006.059469,Does childhood schooling affect old age memory or mental status? Using state schooling laws as natural experiments,2008,RELEVANT,OFF_OUTCOME,quasi-experimental,covered schooling or child-labor law,non-fertility outcome,forward,covered legal policy is studied directly,,
W2120429936,10.1111/j.1467-6419.2008.00550.x,EDUCATION AND ENTREPRENEURSHIP SELECTION AND PERFORMANCE: A REVIEW OF THE EMPIRICAL LITERATURE,2008,NOT_RELEVANT,NA,review,n/a,entrepreneurship selection and performance,n/a,Education and entrepreneurship review unrelated to fertility or the covered laws.,,
W2103761182,10.1111/j.1542-4774.2011.01048.x,EDUCATION AND MOBILITY,2008,NOT_RELEVANT,NA,other,n/a,n/a,n/a,No covered child-labor or compulsory-schooling policy-to-fertility relationship is indicated.,,
W4300464405,10.1057/978-1-349-95121-5_2819-1,Economic Growth in the Very Long Run,2008,NOT_RELEVANT,NA,theory,n/a,n/a,n/a,No covered child-labor or compulsory-schooling policy-to-fertility relationship is indicated.,,
W4416091399,10.1007/978-1-349-58802-2_433,Economic Growth in the Very Long Run,2008,NOT_RELEVANT,NA,other,n/a,n/a,n/a,title and abstract do not study a covered legal-policy mechanism,,
W2335097395,,Economic Growth with Locked-in Childbirth: From Under-to Over- Investment in Education,2008,RELEVANT,OFF_EXPOSURE,observational,education or schooling,fertility,forward,Studies education access or attainment and fertility without a clearly covered legal mandate.,,
W1586039517,,Essays on Schooling and Child Labour in Portugal,2008,NOT_RELEVANT,NA,observational,n/a,n/a,n/a,does not study a covered legal-policy mechanism,,
W1913969375,10.1111/j.1468-0297.2010.02365.x,Forced to Be Rich? Returns to Compulsory Schooling in Britain,2008,UNCERTAIN,OFF_OUTCOME,other,covered schooling or child-labor law,unclear outcome,forward,title is plausibly relevant but no abstract is available,,
W4205385538,10.1057/978-1-349-95121-5_2848-1,Growth Take-Offs,2008,NOT_RELEVANT,NA,observational,n/a,n/a,n/a,does not study a covered legal-policy mechanism,,
W4416091258,10.1007/978-1-349-58802-2_690,Growth Take-Offs,2008,NOT_RELEVANT,NA,observational,n/a,n/a,n/a,does not study a covered legal-policy mechanism,,
W4299681539,10.1057/978-1-349-95121-5_2229-1,"Human Capital, Fertility and Growth",2008,NOT_RELEVANT,NA,other,n/a,n/a,n/a,title and abstract do not study a covered legal-policy mechanism,,
W4416091306,10.1007/978-1-349-58802-2_753,"Human Capital, Fertility and Growth",2008,NOT_RELEVANT,NA,other,n/a,n/a,n/a,title and abstract do not study a covered legal-policy mechanism,,
W2208583202,10.2139/ssrn.1083636,"Human Capital, Political Change, and Long-Run Economic Growth",2008,NOT_RELEVANT,NA,other,n/a,n/a,n/a,No covered child-labor or compulsory-schooling policy-to-fertility relationship is indicated.,,
W2024881867,10.1111/j.1468-2516.2008.00275.x,"Humankapital, politischer Wandel und langfristige Wirtschaftsentwicklung",2008,NOT_RELEVANT,NA,theory,n/a,n/a,n/a,does not study a covered legal-policy mechanism,,
W1591116046,,"If Johnny Can't Work, Can Johnny Read Better?: Child Labor Laws, Labor Supply and Schooling Outcomes",2008,RELEVANT,OFF_OUTCOME,review,child-labor regulation,schooling or child labor,forward,Directly examines a covered policy or mechanism first stage without a fertility outcome.,,
W2105085862,10.1111/j.1467-937x.2008.00506.x,"Inequality in Landownership, the Emergence of Human-Capital Promoting Institutions, and the Great Divergence",2008,NOT_RELEVANT,NA,structural,n/a,education expenditure,n/a,Studies land inequality and human-capital institutions without a fertility outcome or covered law.,,
W4236980260,10.1787/9789264044197-10-en,Intergenerational Mobility,2008,NOT_RELEVANT,NA,observational,n/a,n/a,n/a,No covered child-labor or compulsory-schooling policy-to-fertility relationship is indicated.,,
W2119753356,10.1162/jeea.2009.7.2-3.508,International Labor Standards and the Political Economy of Child Labor Regulation,2008,UNCERTAIN,OFF_OUTCOME,other,child-labor regulation,schooling or child labor,forward,"Title suggests a potentially covered relationship, but the missing or ambiguous abstract prevents confident routing.",,
W1559422547,10.1108/03068290810905432,"International trade, foreign direct investment and the phenomenon of child labor",2008,RELEVANT,OFF_OUTCOME,quasi-experimental,covered schooling or child-labor law,non-fertility outcome,forward,covered legal policy is studied directly,,
W2012763565,10.1016/j.jdeveco.2008.09.002,Is product boycott a good idea for controlling child labor? A theoretical investigation,2008,UNCERTAIN,OFF_OUTCOME,other,potential covered policy,n/a,n/a,title is plausibly relevant but no abstract is supplied,,
W2171862933,10.1111/j.1468-2354.2008.00498.x,LOOKING AT THE “POPULATION PROBLEM” THROUGH THE PRISM OF HETEROGENEITY: WELFARE AND POLICY ANALYSES*,2008,NOT_RELEVANT,NA,other,n/a,n/a,n/a,title and abstract do not study a covered legal-policy mechanism,,
W2136413534,,Legislation for Child Labor and Compulsory Schooling in Pakistan: Some Issues,2008,RELEVANT,OFF_OUTCOME,observational,compulsory-schooling law,schooling or child labor,forward,Directly examines a covered policy or mechanism first stage without a fertility outcome.,,
W2047640947,10.1007/s11065-008-9064-z,Lifecourse Social Conditions and Racial and Ethnic Patterns of Cognitive Aging,2008,NOT_RELEVANT,NA,observational,n/a,n/a,n/a,does not study a covered legal-policy mechanism,,
