paperId,doi,title,year,verdict,estimand_cell,evidence_type,treatment,outcome,direction,reason,ra_decision,ra_note
W3175388544,10.3386/w28937,The Impact of Free Secondary Education: Experimental Evidence from Ghana,2021,RELEVANT,OFF_EXPOSURE,quasi-experimental,randomized secondary-school scholarship,female fertility,forward,Causally estimates education access on fertility but uses a scholarship rather than a covered legal mandate.,,
W4206724210,10.1093/cesifo/ifab014,The Length of Schooling and the Timing of Family Formation,2021,NOT_RELEVANT,NA,other,n/a,n/a,n/a,title and abstract do not study a covered legal-policy mechanism,,
W3217403044,10.2139/ssrn.3969573,The Work-to-School Transition: Job Displacement and Skill Upgrading Among Young High School Dropouts,2021,NOT_RELEVANT,NA,other,n/a,n/a,n/a,title and abstract do not study a covered legal-policy mechanism,,
W3162923431,10.1080/09645292.2021.1923661,The causal effects of education on welfare participation in the US,2021,RELEVANT,OFF_OUTCOME,theory,child-labor or minimum-age regulation,child labor,forward,estimates or analyzes a covered law first stage or non-fertility effect,,
W2953088171,10.1016/j.econedurev.2021.102124,The effect of education on poverty: A European perspective,2021,NOT_RELEVANT,NA,other,n/a,n/a,n/a,title and abstract do not study a covered legal-policy mechanism,,
W3135947219,10.1080/00036846.2021.1877253,The effect of female education on child mortality: evidence from Indonesia,2021,NOT_RELEVANT,NA,quasi-experimental,n/a,n/a,n/a,does not study a covered legal-policy mechanism,,
W3207304181,10.1080/17441730.2021.1986253,The impact of college education on women’s fertility: evidence from a natural experiment in South Korea,2021,NOT_RELEVANT,NA,quasi-experimental,n/a,n/a,n/a,does not study a covered legal-policy mechanism,,
W3173652246,10.1080/13504851.2021.1946002,The impact of education on mental health: evidence from compulsory education law in China,2021,RELEVANT,OFF_OUTCOME,quasi-experimental,covered schooling or child-labor law,non-fertility outcome,forward,covered legal policy is studied directly,,
W3122178056,10.1111/ecin.12992,The influence of hidden researcher decisions in applied microeconomics,2021,NOT_RELEVANT,NA,other,n/a,n/a,n/a,title and abstract do not study a covered legal-policy mechanism,,
W3200468916,10.1016/j.ssmph.2021.100918,The relationship between educational attainment and hospitalizations among middle-aged and older adults in the United States,2021,NOT_RELEVANT,NA,theory,n/a,n/a,n/a,does not study a covered legal-policy mechanism,,
W3164409131,10.1007/s00148-021-00823-8,Under- and over-investment in education: the role of locked-in fertility,2021,RELEVANT,OFF_EXPOSURE,observational,education or schooling,fertility,forward,Studies education access or attainment and fertility without a clearly covered legal mandate.,,
W3040108475,10.1257/pol.20180677,Women’s Suffrage and Children’s Education,2021,NOT_RELEVANT,NA,quasi-experimental,n/a,n/a,n/a,does not study a covered legal-policy mechanism,,
W3048668746,10.1920/wp.ifs.2020.2820,A second chance? Labor market returns to adult education using school reforms,2020,NOT_RELEVANT,NA,other,n/a,n/a,n/a,title and abstract do not study a covered legal-policy mechanism,,
W3106158244,10.1016/j.ijer.2020.101693,Assessing the causal impact of compulsory schooling policy in Indonesia,2020,RELEVANT,OFF_OUTCOME,quasi-experimental,compulsory-schooling law,n/a,forward,title directly names a covered law but outcome detail is absent,,
W3006219298,10.1007/s00148-020-00771-9,Books or babies? The incapacitation effect of schooling on minority women,2020,RELEVANT,TEMPO,quasi-experimental,compulsory school-leaving-age increase,teenage motherhood,forward,reform reduced and delayed teenage motherhood,,
W3045726075,10.1007/s11698-020-00212-3,Can pandemics affect educational attainment? Evidence from the polio epidemic of 1916,2020,NOT_RELEVANT,NA,observational,n/a,n/a,n/a,does not study a covered legal-policy mechanism,,
W3095532865,10.2139/ssrn.3665046,Car Seats as Contraception,2020,NOT_RELEVANT,NA,observational,n/a,n/a,n/a,does not study a covered legal-policy mechanism,,
W4249491397,10.1007/978-981-15-3106-4_3,Child Labour and Human Capital in Developing Countries: A Multi-Period Stochastic Model,2020,UNCERTAIN,OFF_OUTCOME,other,potential covered policy,n/a,n/a,title is plausibly relevant but no abstract is supplied,,
W4233087197,10.1007/978-981-10-2362-0_20,Compulsory Educational Provision,2020,NOT_RELEVANT,NA,observational,n/a,n/a,n/a,does not study a covered legal-policy mechanism,,
W3045651457,10.1086/711038,"Do Grandparents Matter? Multigenerational Mobility in the United States, 1940–2015",2020,NOT_RELEVANT,NA,observational,n/a,n/a,n/a,No covered child-labor or compulsory-schooling policy-to-fertility relationship is indicated.,,
W3035588176,10.3386/w27103,Do Youth Employment Programs Work? Evidence from the New Deal,2020,NOT_RELEVANT,NA,other,n/a,n/a,n/a,title and abstract do not study a covered legal-policy mechanism,,
W3113067867,10.2139/ssrn.3713890,Does the Early Bird Catch the Worm? Evidence and Interpretation on the Long-Term Impact of School Entry Age in China,2020,NOT_RELEVANT,NA,other,n/a,n/a,n/a,title and abstract do not study a covered legal-policy mechanism,,
W3007829827,10.1017/s0007123419000504,Education and Attitudes toward Redistribution in the United States,2020,NOT_RELEVANT,NA,other,n/a,n/a,n/a,title and abstract do not study a covered legal-policy mechanism,,
W3047728892,10.1177/1529100620920576,Education and Cognitive Functioning Across the Life Span,2020,NOT_RELEVANT,NA,other,n/a,n/a,n/a,title and abstract do not study a covered legal-policy mechanism,,
W4248387665,10.1016/b978-0-12-815391-8.00010-0,Education and inequality,2020,NOT_RELEVANT,NA,observational,n/a,n/a,n/a,does not study a covered legal-policy mechanism,,
W3097916176,10.1086/711761,Effects of Maternal Education on Early Nonmonetary Investments in Child Development,2020,RELEVANT,OFF_OUTCOME,quasi-experimental,covered schooling or child-labor law,non-fertility outcome,forward,covered legal policy is studied directly,,
W3029767482,10.1016/j.worlddev.2020.105014,"Effects of motherhood timing, breastmilk substitutes and education on the duration of breastfeeding: Evidence from Egypt",2020,NOT_RELEVANT,NA,other,n/a,n/a,n/a,title and abstract do not study a covered legal-policy mechanism,,
W2998741778,10.1016/b978-0-12-815391-8.00001-x,Empirical methods in the economics of education,2020,NOT_RELEVANT,NA,other,n/a,n/a,n/a,title and abstract do not study a covered legal-policy mechanism,,
W3112066496,10.1016/j.jeconom.2020.09.006,Estimating dynamic treatment effects in event studies with heterogeneous treatment effects,2020,NOT_RELEVANT,NA,other,n/a,event-study treatment effects,n/a,General causal-inference methods paper unrelated to the substantive hypothesis.,,
W3017366657,10.3897/popecon.4.e53039,Factors of fertility ageing rate,2020,NOT_RELEVANT,NA,other,n/a,n/a,n/a,title and abstract do not study a covered legal-policy mechanism,,
W3081943314,10.1111/rode.12704,Fertility decisions of families in an intergenerational exchange model,2020,NOT_RELEVANT,NA,theory,n/a,n/a,n/a,does not study a covered legal-policy mechanism,,
W3173493406,10.1596/1813-9450-9105,"Free Primary Education, Fertility, And Women's Access To The Labor Market : Evidence From Ethiopia",2020,RELEVANT,OFF_EXPOSURE,theory,education expansion or reform,fertility timing,forward,Studies education access or attainment and fertility without a clearly covered legal mandate.,,
W3101287853,10.1016/j.econedurev.2020.102059,Higher education and fertility: Evidence from reforms in Greece,2020,UNCERTAIN,OFF_EXPOSURE,other,education or schooling,fertility or family formation,forward,title is plausibly relevant but no abstract is available,,
W3123997382,10.2139/ssrn.3718156,Impact of Termination of Universal Primary Education on Lifelong Fertility and Child Educational Quality: Evidence From Kenya,2020,UNCERTAIN,OFF_EXPOSURE,other,education or schooling,fertility or family formation,forward,title is plausibly relevant but no abstract is available,,
W3101444895,10.26509/frbc-wp-201533r,Industrial Composition and Educational Intergenerational Mobility,2020,NOT_RELEVANT,NA,other,n/a,n/a,n/a,title and abstract do not study a covered legal-policy mechanism,,
W3011742881,10.1093/jeea/jvaa006,Intergenerational Associations and the Fertility Transition,2020,NOT_RELEVANT,NA,other,n/a,n/a,n/a,title and abstract do not study a covered legal-policy mechanism,,
W4232239060,10.2139/ssrn.3608525,Keeping Kids in School and Out of Work: Compulsory Schooling and Child Labor in Turkey,2020,UNCERTAIN,OFF_OUTCOME,other,covered schooling or child-labor law,child labor,forward,title is plausibly relevant but no abstract is available,,
W3007702571,10.1017/s0022050719000779,Long-Run Impacts of Agricultural Shocks on Educational Attainment: Evidence from the Boll Weevil,2020,RELEVANT,MODE_PRODUCTION,observational,productive value of children,child labor or fertility,forward,Links the productive value of children or child labor to fertility outside covered legal variation.,,
W2911385571,10.1016/b978-0-12-815391-8.00019-7,Monetary and non-monetary incentives for educational attainment: design and effectiveness,2020,NOT_RELEVANT,NA,other,n/a,n/a,n/a,title and abstract do not study a covered legal-policy mechanism,,
W3000315257,10.1016/b978-0-12-815391-8.00007-0,Parental education and children's health throughout life,2020,NOT_RELEVANT,NA,other,n/a,n/a,n/a,title and abstract do not study a covered legal-policy mechanism,,
W3108885138,10.1596/1813-9450-9420,Secondary Schools and Teenage Childbearing : Evidence from the School Expansion in Brazilian Municipalities,2020,NOT_RELEVANT,NA,other,n/a,n/a,n/a,title and abstract do not study a covered legal-policy mechanism,,
W3091923028,10.1093/wber/lhaa022,Secondary Schools and Teenage Childbearing: Evidence from the School Expansion in Brazilian Municipalities,2020,NOT_RELEVANT,NA,other,n/a,n/a,n/a,title and abstract do not study a covered legal-policy mechanism,,
W3041085865,10.2478/izajodm-2020-0010,Secondary education and international labor mobility: evidence from the natural experiment in the Philippines,2020,NOT_RELEVANT,NA,quasi-experimental,n/a,n/a,n/a,does not study a covered legal-policy mechanism,,
W3111575516,10.2139/ssrn.3680730,"The Dark Side of Batteries: Education, Fertility and Cobalt Mining in the Democratic Republic of Congo",2020,NOT_RELEVANT,NA,other,n/a,n/a,n/a,title and abstract do not study a covered legal-policy mechanism,,
W2893680866,10.1257/jel.20191316,The Economics of Language,2020,NOT_RELEVANT,NA,other,n/a,n/a,n/a,title and abstract do not study a covered legal-policy mechanism,,
W3037191243,10.1007/s00148-020-00787-1,The education gender gap and the demographic transition in developing countries,2020,NOT_RELEVANT,NA,other,n/a,education gender gap and demographic transition,n/a,Title indicates education and demographic transition but no covered legal-policy treatment.,,
W2795910881,10.1016/j.jhealeco.2019.102250,The effect of prenatal maternity leave on short and long-term child outcomes,2020,NOT_RELEVANT,NA,other,n/a,n/a,n/a,title and abstract do not study a covered legal-policy mechanism,,
W3010409071,10.31390/gradschool_dissertations.5159,Three Essays on the Economics of Education,2020,UNCERTAIN,OFF_EXPOSURE,quasi-experimental,universal primary education program,female fertility,forward,"Dissertation includes a causal education-to-fertility chapter, but the abstract does not establish a covered compulsory-schooling mandate.",,
W3000055925,10.5296/jpag.v10i1.15429,Trade and Child Labor: A Review of Literature,2020,NOT_RELEVANT,NA,review,n/a,n/a,n/a,does not study a covered legal-policy mechanism,,
W2979586175,10.1257/aer.20181169,Two-Way Fixed Effects Estimators with Heterogeneous Treatment Effects,2020,NOT_RELEVANT,NA,observational,n/a,n/a,n/a,No covered child-labor or compulsory-schooling policy-to-fertility relationship is indicated.,,
W2911692517,10.1007/978-3-030-11313-1_9,"A Hard Day’s Night: Provision of Public Evening Schools in the United States, 1870–1910",2019,NOT_RELEVANT,NA,other,n/a,n/a,n/a,title and abstract do not study a covered legal-policy mechanism,,
W2945544486,10.1257/pandp.20191013,A Reason to Wait: The Effect of Legal Status on Teen Pregnancy,2019,NOT_RELEVANT,NA,observational,n/a,n/a,n/a,No covered child-labor or compulsory-schooling policy-to-fertility relationship is indicated.,,
W2974664342,10.1016/j.eeh.2019.101304,A machine learning approach to improving occupational income scores,2019,NOT_RELEVANT,NA,other,n/a,n/a,n/a,title and abstract do not study a covered legal-policy mechanism,,
W2942525780,10.1007/s13524-019-00782-6,Advanced School Progression Relative to Age and Early Family Formation in Mexico,2019,NOT_RELEVANT,NA,observational,n/a,n/a,n/a,does not study a covered legal-policy mechanism,,
W2995675284,10.1016/j.ssmph.2019.100526,Alternative causal inference methods in population health research: Evaluating tradeoffs and triangulating evidence,2019,NOT_RELEVANT,NA,quasi-experimental,n/a,n/a,n/a,does not study a covered legal-policy mechanism,,
W2787274450,10.1162/rest_a_00824,Breaking the Cycle? Education and the Intergenerational Transmission of Violence,2019,RELEVANT,OFF_OUTCOME,quasi-experimental,compulsory-schooling reform,non-fertility outcome,forward,estimates or analyzes a covered law first stage or non-fertility effect,,
W2916024336,10.1086/703123,Can Compulsory Schooling Reduce Language-Based Educational Gaps? Evidence from a Policy Change in Paraguay,2019,RELEVANT,OFF_OUTCOME,quasi-experimental,compulsory-schooling reform,non-fertility outcome,forward,estimates or analyzes a covered law first stage or non-fertility effect,,
W2938479017,10.1007/s13524-019-00771-9,Causal Impact of Having a College Degree on Women’s Fertility: Evidence From Regression Kink Designs,2019,NOT_RELEVANT,NA,theory,n/a,n/a,n/a,does not study a covered legal-policy mechanism,,
W2945124658,10.1016/j.ssmph.2019.100386,Causal effects of education on sexual and reproductive health in low and middle-income countries: A systematic review and meta-analysis,2019,NOT_RELEVANT,NA,other,n/a,n/a,n/a,title and abstract do not study a covered legal-policy mechanism,,
W2989559236,10.1332/175795919x15659210629362,Causality in life course research: the potential use of ‘natural experiments’ for causal inference,2019,NOT_RELEVANT,NA,quasi-experimental,n/a,n/a,n/a,No covered child-labor or compulsory-schooling policy-to-fertility relationship is indicated.,,
W2912359857,10.1007/s00199-019-01176-w,Child labor and compulsory education: the effects of government education policy on economic growth and welfare,2019,NOT_RELEVANT,NA,observational,n/a,n/a,n/a,does not study a covered legal-policy mechanism,,
W3123907772,10.1257/mic.20170039,Competition in Treasury Auctions,2019,NOT_RELEVANT,NA,observational,n/a,n/a,n/a,does not study a covered legal-policy mechanism,,
W2987280424,10.1007/978-981-10-0942-6_20-1,Compulsory Educational Provision,2019,NOT_RELEVANT,NA,observational,n/a,n/a,n/a,does not study a covered legal-policy mechanism,,
W2562260113,10.3390/econometrics7030036,Compulsory Schooling and Returns to Education: A Re-Examination,2019,RELEVANT,OFF_OUTCOME,quasi-experimental,compulsory-schooling law,schooling or child labor,forward,Directly examines a covered policy or mechanism first stage without a fertility outcome.,,
W2952901519,10.1016/j.econedurev.2019.06.001,"Compulsory schooling for whom? The role of gender, poverty, and religiosity",2019,UNCERTAIN,OFF_OUTCOME,other,compulsory-schooling law,schooling or child labor,forward,"Title suggests a potentially covered relationship, but the missing or ambiguous abstract prevents confident routing.",,
W2948878644,,DID_MULTIPLEGT: Stata module to estimate sharp Difference-in-Difference designs with multiple groups and periods,2019,NOT_RELEVANT,NA,observational,n/a,n/a,n/a,No covered child-labor or compulsory-schooling policy-to-fertility relationship is indicated.,,
W2968921468,10.1111/sjoe.12391,Demographic Transition and Fertility Rebound in Economic Development*,2019,NOT_RELEVANT,NA,theory,n/a,n/a,n/a,does not study a covered legal-policy mechanism,,
W3164082621,10.2139/ssrn.3437984,Does High School Size Matter for Risky Behaviors and Mental Health of Low-Income Teenagers? Evidence from New York City,2019,NOT_RELEVANT,NA,other,n/a,n/a,n/a,title and abstract do not study a covered legal-policy mechanism,,
W2154210580,10.1016/j.jhealeco.2019.102268,Does education reduce teen fertility? Evidence from compulsory schooling laws,2019,UNCERTAIN,TEMPO,other,covered schooling or child-labor law,fertility or family formation,forward,title is plausibly relevant but no abstract is available,,
W2955401496,10.1007/978-3-030-21351-0_7,"Education, Gender Gap, and Market Openness: A Comparative Study of Urban Latin America and East Asia (1970–2000)",2019,NOT_RELEVANT,NA,observational,n/a,n/a,n/a,does not study a covered legal-policy mechanism,,
W2955532978,10.1371/journal.pmed.1002834,Educational attainment and cardiovascular disease in the United States: A quasi-experimental instrumental variables analysis,2019,RELEVANT,OFF_OUTCOME,theory,compulsory-schooling reform,schooling outcomes,forward,estimates or analyzes a covered law first stage or non-fertility effect,,
W2525773619,10.13128/rea-18635,Effects of land related factors on child labour in agriculture: evidences from Peru,2019,NOT_RELEVANT,NA,theory,n/a,n/a,n/a,does not study a covered legal-policy mechanism,,
W2972800761,10.33324/udaakadem.v1i3.203,El gasto público en educación y su impacto en el crecimiento de la economía ecuatoriana 2007-2017,2019,NOT_RELEVANT,NA,other,n/a,n/a,n/a,title and abstract do not study a covered legal-policy mechanism,,
W2891445448,10.1177/1536867x19830877,Fast and wild: Bootstrap inference in Stata using boottest,2019,NOT_RELEVANT,NA,other,n/a,n/a,n/a,title and abstract do not study a covered legal-policy mechanism,,
W2946826152,10.35537/10915/74463,Fecundidad adolescente y educación ¿causa o consecuencia?,2019,NOT_RELEVANT,NA,observational,n/a,n/a,n/a,does not study a covered legal-policy mechanism,,
W2749109812,10.1093/wber/lhz042,"Free Primary Education, Fertility, and Women’s Access to the Labor Market: Evidence from Ethiopia",2019,RELEVANT,OFF_EXPOSURE,theory,education expansion or reform,fertility timing,forward,Studies education access or attainment and fertility without a clearly covered legal mandate.,,
W2912561219,10.1016/j.econmod.2019.01.011,From family security to the welfare state: Path dependency of social security on the difference in legal origins,2019,NOT_RELEVANT,NA,other,n/a,n/a,n/a,title and abstract do not study a covered legal-policy mechanism,,
W2954822871,10.1177/1536867x19854019,Fuzzy differences-in-differences with Stata,2019,NOT_RELEVANT,NA,review,n/a,n/a,n/a,does not study a covered legal-policy mechanism,,
W2991315069,10.1177/0003122419886550,"Genes, Gender Inequality, and Educational Attainment",2019,RELEVANT,OFF_EXPOSURE,observational,education or schooling,fertility timing,forward,Studies education access or attainment and fertility without a clearly covered legal mandate.,,
W2990295180,10.1007/978-3-030-21599-6_7,"Health Spending, Education and Endogenous Demographics in an OLG Model",2019,NOT_RELEVANT,NA,other,n/a,n/a,n/a,title and abstract do not study a covered legal-policy mechanism,,
W2908140349,10.1016/j.labeco.2019.101748,Immigrants move where their skills are scarce: Evidence from English proficiency,2019,NOT_RELEVANT,NA,observational,n/a,n/a,n/a,does not study a covered legal-policy mechanism,,
W4241518675,10.1007/978-3-030-00181-0_27,Labor Markets,2019,NOT_RELEVANT,NA,other,n/a,n/a,n/a,No covered child-labor or compulsory-schooling policy-to-fertility relationship is indicated.,,
W2911332409,10.1007/978-3-319-99480-2_3,Marital Fertility and Investment in Children’s Education,2019,NOT_RELEVANT,NA,other,n/a,n/a,n/a,title and abstract do not study a covered legal-policy mechanism,,
W2966371935,10.1108/s0731-90532019000040a013,New Evidence on the Effect of Compulsory Schooling Laws,2019,RELEVANT,OFF_OUTCOME,observational,compulsory-schooling law,schooling or child labor,forward,Directly examines a covered policy or mechanism first stage without a fertility outcome.,,
W2945342602,,Number of Births and Quality of Education- Evidence from CEPS and a New Explanation,2019,NOT_RELEVANT,NA,other,n/a,n/a,n/a,title and abstract do not study a covered legal-policy mechanism,,
W3122498362,10.1093/jeea/jvz059,Perverse Consequences of Well Intentioned Regulation: Evidence from India’s Child Labor Ban,2019,RELEVANT,OFF_OUTCOME,theory,child-labor or minimum-age regulation,child labor,forward,estimates or analyzes a covered law first stage or non-fertility effect,,
W2921695319,10.1016/j.econedurev.2019.03.001,School resources and labor market outcomes: Evidence from early twentieth-century Georgia,2019,NOT_RELEVANT,NA,other,n/a,n/a,n/a,No covered child-labor or compulsory-schooling policy-to-fertility relationship is indicated.,,
W2966050564,10.1111/padr.12270,Schooling and Labor Market Impacts of Bolivia's <i>Bono Juancito Pinto</i> Program,2019,NOT_RELEVANT,NA,quasi-experimental,n/a,schooling and labor-market outcomes,n/a,Evaluates a cash-transfer program rather than the covered legal mandates.,,
W2911056353,10.1016/j.econedurev.2019.01.002,Schooling with learning: The effect of free primary education and mother tongue instruction reforms in Ethiopia,2019,NOT_RELEVANT,NA,other,n/a,n/a,n/a,No covered child-labor or compulsory-schooling policy-to-fertility relationship is indicated.,,
W2979888791,10.1093/aje/kwz221,State School Policies as Predictors of Physical and Mental Health: A Natural Experiment in the REGARDS Cohort,2019,RELEVANT,PRIMARY_CS_QUANTUM,quasi-experimental,compulsory-schooling law,fertility,forward,Estimates a covered legal-policy effect on fertility.,,
W2924921004,10.1162/rest_a_00851,Structural Change and the Fertility Transition,2019,RELEVANT,THEORY,theory,child-labor mechanism,fertility and development,forward,formal model links child labor and fertility without a policy estimand,,
W1138942593,10.1111/ecin.12759,TEENAGE RISKY BEHAVIOR AND PARENTAL SUPERVISION: THE UNINTENDED CONSEQUENCES OF MULTIPLE SHIFTS SCHOOL SYSTEMS,2019,NOT_RELEVANT,NA,other,n/a,n/a,n/a,title and abstract do not study a covered legal-policy mechanism,,
W2258980632,10.1017/s1365100518000937,"THE TWO REVOLUTIONS, LANDED ELITES, AND EDUCATION DURING THE INDUSTRIAL REVOLUTION",2019,NOT_RELEVANT,NA,theory,n/a,n/a,n/a,No covered child-labor or compulsory-schooling policy-to-fertility relationship is indicated.,,
W2921535982,10.3386/w25663,The Impact of Early Investments in Urban School Systems in the United States,2019,NOT_RELEVANT,NA,quasi-experimental,n/a,n/a,n/a,does not study a covered legal-policy mechanism,,
W2947877649,10.5539/ies.v12n6p39,The Impact of Relative Age Effect on Mathematics Achievement,2019,NOT_RELEVANT,NA,theory,n/a,n/a,n/a,title and abstract do not study a covered legal-policy mechanism,,
W2949239210,10.3386/w25994,The Long-Term Impacts of Girl-Friendly Schools: Evidence from the BRIGHT School Construction Program in Burkina Faso,2019,NOT_RELEVANT,NA,other,n/a,n/a,n/a,title and abstract do not study a covered legal-policy mechanism,,
W2978756273,,"The Political Economy of Automation: Its Effects on Workers Past, Present, and Future",2019,NOT_RELEVANT,NA,theory,n/a,n/a,n/a,does not study a covered legal-policy mechanism,,
W2647799028,10.1007/s13524-018-0748-6,The Timing of Teenage Births: Estimating the Effect on High School Graduation and Later-Life Outcomes,2019,NOT_RELEVANT,NA,other,n/a,n/a,n/a,title and abstract do not study a covered legal-policy mechanism,,
W2908334026,10.1257/mac.20170189,The Urban Mortality Transition and Poor-Country Urbanization,2019,NOT_RELEVANT,NA,structural,n/a,urbanization,n/a,"Studies mortality-driven urbanization, not child-labor or compulsory-schooling laws.",,
W2968503131,10.1002/berj.3569,The effect of modular education on school dropout,2019,NOT_RELEVANT,NA,other,n/a,n/a,n/a,title and abstract do not study a covered legal-policy mechanism,,
W2994652547,10.1016/j.jdeveco.2019.102432,"The long reach of cotton in the US South: Tenant farming, mechanization, and low-skill manufacturing",2019,NOT_RELEVANT,NA,other,n/a,n/a,n/a,title and abstract do not study a covered legal-policy mechanism,,
W2990695618,10.17635/lancaster/thesis/776,The role of the government support for education attainment and fertility decisions,2019,NOT_RELEVANT,NA,review,n/a,n/a,n/a,does not study a covered legal-policy mechanism,,
W2795047867,10.3386/w25904,Two-way Fixed Effects Estimators with Heterogeneous Treatment Effects,2019,NOT_RELEVANT,NA,other,n/a,n/a,n/a,title and abstract do not study a covered legal-policy mechanism,,
W4233275314,10.1093/oso/9780190914653.003.0017,Violence,2019,NOT_RELEVANT,NA,quasi-experimental,n/a,n/a,n/a,does not study a covered legal-policy mechanism,,
W2883408152,10.1162/rest_a_00822,When It Rains It Pours: The Long-Run Economic Impacts of Salt Iodization in the United States,2019,NOT_RELEVANT,NA,observational,n/a,n/a,n/a,No covered child-labor or compulsory-schooling policy-to-fertility relationship is indicated.,,
W2980521315,10.1016/j.socscimed.2019.112601,"Who dies early? Education, mortality and causes of death in Norway",2019,RELEVANT,OFF_OUTCOME,theory,compulsory-schooling law,schooling or child labor,forward,Directly examines a covered policy or mechanism first stage without a fertility outcome.,,
